{
        "$schema": "http://json-schema.org/schema#",
        "$schemaVersion": "0.0.1",
        "$id": "https://smart-data-models.github.io/dataModel.TouristProfile/TouristProfile/schema.json,",
        "title": "General profile of a Tourist",
        "description": "Description of a tourist profile based on the characteristics of a person, trip, choice of stay and spending while in destination.",
        "modelTags": "",
        "derivedFrom": "",
        "required": [
                "id",
                "type"
        ],
        "license": "https://smart-data-models.github.io/dataModel.TouristProfile/TouristProfile/LICENSE.md",
        "type": "object",
        "properties": {
                "id": {
                        "type": "string",
                        "format": "uri"
                },
                "type": {
                        "type": "string"
                },
                "country": {
                        "type": "string",
                        "description": "Property. country of nationality - https://en.wikipedia.org/wiki/ISO_3166-1_alpha-2"
                },
                "ageRange": {
                        "type": "object",
                        "description": "Property. age range of the person profiled",
                        "properties": {
                                "range": {
                                        "type": "string"
                                },
                                "sortingOrder": {
                                        "type": "array",
                                        "items": {
                                                "type": "string"
                                        }
                                }
                        }
                },
                "gender": {
                        "type": "string",
                        "description": "Property. gender of the person profiled"
                },
                "travelPartyComposition": {
                        "type": "string",
                        "description": "Property. composition of the travelling party based on the number of adults and children"
                },
                "lodgingType": {
                        "type": "string",
                        "description": "Property. usual type of lodging for the stay"
                },
                "lodgingCategory": {
                        "type": "string",
                        "description": "Property. usual category of the lodging"
                },
                "lodgingSize": {
                        "type": "object",
                        "description": "Property. range size in number of rooms of the lodging",
                        "properties": {
                                "range": {
                                        "type": "string"
                                },
                                "sortingOrder": {
                                        "type": "array",
                                        "items": {
                                                "type": "string"
                                        }
                                }
                        }
                },
                "roomOfStayType": {
                        "type": "string",
                        "description": "Property. usual type of the accomodation room reserved"
                },
                "board": {
                        "type": "string",
                        "description": "Property. usual type of board type reserved"
                },
                "bookingChannel": {
                        "type": "string",
                        "description": "Property. channel used by the tourist for the reservation"
                },
                "reservationLeadTime": {
                        "type": "object",
                        "description": "Property. range of days between booking and check-in",
                        "properties": {
                                "range": {
                                        "type": "string"
                                },
                                "sortingOrder": {
                                        "type": "array",
                                        "items": {
                                                "type": "string"
                                        }
                                }
                        }
                },
                "stayLength": {
                        "type": "object",
                        "description": "Property. range of number of staying nights",
                        "properties": {
                                "range": {
                                        "type": "string"
                                },
                                "sortingOrder": {
                                        "type": "array",
                                        "items": {
                                                "type": "string"
                                        }
                                }
                        }
                },
                "totalExpenditure": {
                        "type": "object",
                        "description": "Property. range of total amount of money invoiced by the lodging establishment",
                        "properties": {
                                "range": {
                                        "type": "string"
                                },
                                "sortingOrder": {
                                        "type": "array",
                                        "items": {
                                                "type": "string"
                                        }
                                }
                        }
                },
                "totalAccomodationAndBoardExpenditure": {
                        "type": "object",
                        "description": "Property. range of total amount of money invoiced by the lodging establishment in accomodation and board concepts",
                        "properties": {
                                "range": {
                                        "type": "string"
                                },
                                "sortingOrder": {
                                        "type": "array",
                                        "items": {
                                                "type": "string"
                                        }
                                }
                        }
                },
                "totalExtraExpenditure": {
                        "type": "object",
                        "description": "Property. range of total amount of money invoiced by the lodging establishment in extra concepts",
                        "properties": {
                                "range": {
                                        "type": "string"
                                },
                                "sortingOrder": {
                                        "type": "array",
                                        "items": {
                                                "type": "string"
                                        }
                                }
                        }
                },
                "avgDailyExpenditure": {
                        "type": "object",
                        "description": "Property. range of avg daily amount of money invoiced by the lodging establishment",
                        "properties": {
                                "range": {
                                        "type": "string"
                                },
                                "sortingOrder": {
                                        "type": "array",
                                        "items": {
                                                "type": "string"
                                        }
                                }
                        }
                },
                "avgDailyAccomodationAndBoardExpenditure": {
                        "type": "object",
                        "description": "Property. range of avg daily amount of money invoiced by the lodging establishment in accomodation and board concepts",
                        "properties": {
                                "range": {
                                        "type": "string"
                                },
                                "sortingOrder": {
                                        "type": "array",
                                        "items": {
                                                "type": "string"
                                        }
                                }
                        }
                },
                "avgDailyExtraExpenditure": {
                        "type": "object",
                        "description": "Property. range of avg daily amount of money invoiced by the lodging establishment in extra concepts",
                        "properties": {
                                "range": {
                                        "type": "string"
                                },
                                "sortingOrder": {
                                        "type": "array",
                                        "items": {
                                                "type": "string"
                                        }
                                }
                        }
                }
        }
}