{
    "id": "urn:hosp:tourpro:0001",
    "type": "TouristProfile",
    "country": "NL",
    "ageRange": {
        "range": "30-34",
        "sortingOrder": [
            "0-1",
            "2-5",
            "6-11",
            "12-17",
            "18-24",
            "25-29",
            "30-34",
            "35-39",
            "40-44",
            "45-49",
            "50-54",
            "55-59",
            "60-64",
            "65+"
        ]
    },
    "gender": "Male",
    "travelPartyComposition": "Couple",
    "lodgingType": "Resort",
    "lodgingCategory": "4 stars",
    "lodgingSize": {
        "range": "101 - 300 Medium",
        "sortingOrder": [
            "0 - 24 Very Small",
            "25 - 100 Small",
            "101 - 300 Medium",
            "301 - 700 Large",
            "701 - 1200 Very Large",
            "1201+ Massive"
        ]
    },
    "roomOfStayType": "Double",
    "board": "half-board",
    "bookingChannel": "Tour Operator",
    "reservationLeadTime": {
        "range": "91 to 120 days",
        "sortingOrder": [
            "1 to 7 Days",
            "8 to 14 Days",
            "15 to 30 Days",
            "31 to 60 Days",
            "61 to 90 Days",
            "91 to 120 Days",
            "121 to 240 Days",
            "241 to 365 Days",
            "366+ Days"
        ]
    },
    "stayLength": {
        "range": "5 to 7 days",
        "sortingOrder": [
            "1 day",
            "2 to 4 days",
            "5 to 7 days",
            "8 to 14 days",
            "15 to 21 days",
            "22+ days"
        ]
    },
    "totalExpenditure": {
        "range": "1250 to 1499 ?",
        "sortingOrder": [
            "0 to 249 ?",
            "250 to 499 ?",
            "250 to 499 ?",
            "500 to 749 ?",
            "750 to 999 ?",
            "1000 to 1499 ?",
            "1500 to 1999 ?",
            "2000 to 2999 ?",
            "3000 to 3999 ?",
            "4000 to 4999 ?",
            "5000+ ?"
        ]
    },
    "totalAccomodationAndBoardExpenditure": {
        "range": "1000 to 1249 ?",
        "sortingOrder": [
            "0 to 249 ?",
            "250 to 499 ?",
            "250 to 499 ?",
            "500 to 749 ?",
            "750 to 999 ?",
            "1000 to 1499 ?",
            "1500 to 1999 ?",
            "2000 to 2999 ?",
            "3000 to 3999 ?",
            "4000 to 4999 ?",
            "5000+ ?"
        ]
    },
    "totalExtraExpenditure": {
        "range": "0 to 249 ?",
        "sortingOrder": [
            "0 to 249 ?",
            "250 to 499 ?",
            "250 to 499 ?",
            "500 to 749 ?",
            "750 to 999 ?",
            "1000 to 1499 ?",
            "1500 to 1999 ?",
            "2000 to 2999 ?",
            "3000 to 3999 ?",
            "4000 to 4999 ?",
            "5000+ ?"
        ]
    },
    "avgDailyExpenditure": {
        "range": "200 to 249 ?",
        "sortingOrder": [
            "0 to 24 ?",
            "25 to 49 ?",
            "50 to 74 ?",
            "75 to 99 ?",
            "100 to 149 ?",
            "150 to 199 ?",
            "200 to 249 ?",
            "250 to 299 ?",
            "300 to 399 ?",
            "400 to 499 ?",
            "500 to 599 ?",
            "600+ ?"
        ]
    },
    "avgDailyAccomodationAndBoardExpenditure": {
        "range": "200 to 249 ?",
        "sortingOrder": [
            "0 to 24 ?",
            "25 to 49 ?",
            "50 to 74 ?",
            "75 to 99 ?",
            "100 to 149 ?",
            "150 to 199 ?",
            "200 to 249 ?",
            "250 to 299 ?",
            "300 to 399 ?",
            "400 to 499 ?",
            "500 to 599 ?",
            "600+ ?"
        ]
    },
    "avgDailyExtraExpenditure": {
        "range": "0 to 24 ?",
        "sortingOrder": [
            "0 to 24 ?",
            "25 to 49 ?",
            "50 to 74 ?",
            "75 to 99 ?",
            "100 to 149 ?",
            "150 to 199 ?",
            "200 to 249 ?",
            "250 to 299 ?",
            "300 to 399 ?",
            "400 to 499 ?",
            "500 to 599 ?",
            "600+ ?"
        ]
    }
}